{
    "light_model_path":  "models/student_tiny_improved.pth",
    "heavy_model_path":  "models/heavy_rf_improved.joblib",
    "onnx_model_path":  "models/student_tiny_improved.onnx",
    "can_window_size":  100,
    "eth_window_size":  1,
    "routing_threshold":  0.5781,
    "latency_budget_ms":  100.0,
    "fpr_budget":  0.05,
    "fail_safe_mode":  "degraded",
    "model_integrity_sha256":  "b58f756be2e13f28b43e6e3407ff0d6dc0c5f4aa020b83936dbcefa2fd7b2cb5",
    "can_source":  "datasets/replica_can_b1_engineered/can_dos_train.csv",
    "eth_source":  "datasets/replica_eth_smoke/eth_driving_01_injected_replica_packets.csv",
    "alert_output_path":  "logs/runtime_alerts.jsonl",
    "use_onnx":  true,
    "max_samples":  100
}
