{
    "light_model_path":  "models/student_tiny_improved.pth",
    "heavy_model_path":  "models/heavy_rf.joblib",
    "onnx_model_path":  "models/student_tiny_improved.onnx",
    "can_window_size":  100,
    "eth_window_size":  1,
    "routing_threshold": 0.0001,
    "latency_budget_ms":  100.0,
    "fpr_budget":  0.05,
    "fail_safe_mode":  "degraded",
    "model_integrity_sha256":  "57d2445d04b7f63f0c36ab3c3db70da65d604f613be627f9fef6e2bfc26ef1fc",
    "can_source":  "datasets/can_dos_train.csv",
    "eth_source":  "datasets/replica_eth_smoke/eth_driving_01_injected_replica_packets.csv",
    "alert_output_path":  "logs/runtime_alerts.jsonl",
    "use_onnx":  true,
    "max_samples":  100
}

